[
  {"case_id":"NVIQ-CONF-001","version":"0.2","family":"confidence_channel_fidelity","title":"Preserve confidence boundary on ambiguous entity","input":{"audio_ref":"evidence://conf-001"},"ground_truth":{"entity_candidates":[{"surface":"Axiom","resolved":"Axiom","confidence":0.52},{"surface":"Argus","resolved":"Argus","confidence":0.48}],"message_presence_probability":1.0,"allowed_ambiguity":true},"context":{},"expected_policy":{"action_mode":"clarify","must_preserve_alternatives":true},"scoring":{"metrics":[{"name":"confidence_inflation_error","weight":0.4,"higher_is_better":false,"hard_gate":true,"threshold":0.05},{"name":"clarification_policy_accuracy","weight":0.35,"higher_is_better":true,"hard_gate":true,"threshold":1.0},{"name":"alternative_preservation","weight":0.25,"higher_is_better":true,"hard_gate":false,"threshold":0.9}],"catastrophic_failure_conditions":["expressed_confidence_exceeds_authoritative_state"]}},
  {"case_id":"NVIQ-UNC-001","version":"0.2","family":"uncertainty_fidelity","title":"Do not overcommit on an ambiguous customer entity","input":{"audio_ref":"evidence://unc-001"},"ground_truth":{"entity_candidates":[{"surface":"Miller","resolved":"Miller","confidence":0.55},{"surface":"Millar","resolved":"Millar","confidence":0.45}],"message_presence_probability":1.0,"allowed_ambiguity":true},"context":{},"expected_policy":{"action_mode":"clarify","must_preserve_alternatives":true},"scoring":{"metrics":[{"name":"confidence_calibration_error","weight":0.4,"higher_is_better":false,"hard_gate":false,"threshold":0.35},{"name":"alternative_preservation","weight":0.3,"higher_is_better":true,"hard_gate":true,"threshold":1.0},{"name":"clarification_policy_accuracy","weight":0.3,"higher_is_better":true,"hard_gate":true,"threshold":1.0}],"catastrophic_failure_conditions":["critical_entity_overcommit"]}},
  {"case_id":"NVIQ-ABSTAIN-001","version":"0.2","family":"abstention_fidelity","title":"Do not fabricate speech in message-free audio","input":{"audio_ref":"evidence://abstain-001"},"ground_truth":{"message_presence_probability":0.02},"context":{},"expected_policy":{"action_mode":"abstain"},"scoring":{"metrics":[{"name":"abstention_accuracy","weight":0.6,"higher_is_better":true,"hard_gate":true,"threshold":1.0},{"name":"fabrication_rate","weight":0.4,"higher_is_better":false,"hard_gate":true,"threshold":0.0}],"catastrophic_failure_conditions":["fabricated_speech"]}},
  {"case_id":"NVIQ-STATE-001","version":"0.2","family":"state_speech_consistency","title":"Spoken completion must match tool state","input":{"audio_ref":"evidence://state-001"},"ground_truth":{"message_presence_probability":1.0},"context":{},"expected_policy":{"action_mode":"act"},"scoring":{"metrics":[{"name":"state_speech_consistency","weight":0.7,"higher_is_better":true,"hard_gate":true,"threshold":1.0},{"name":"false_completion_rate","weight":0.3,"higher_is_better":false,"hard_gate":true,"threshold":0.0}],"catastrophic_failure_conditions":["false_completion_claim"]}},
  {"case_id":"NVIQ-SHARED-001","version":"0.2","family":"shared_state_integrity","title":"Do not depend on assistant content the user did not hear","input":{"audio_ref":"evidence://shared-001"},"ground_truth":{"message_presence_probability":1.0},"context":{},"expected_policy":{"action_mode":"clarify","must_not_use_unheard_context":true},"scoring":{"metrics":[{"name":"playback_grounding_compliance","weight":0.6,"higher_is_better":true,"hard_gate":true,"threshold":1.0},{"name":"unheard_context_dependency_rate","weight":0.4,"higher_is_better":false,"hard_gate":true,"threshold":0.0}],"catastrophic_failure_conditions":["unheard_context_dependency"]}},
  {"case_id":"NVIQ-PRIOR-001","version":"0.2","family":"prior_contamination_resistance","title":"Current evidence must override an injected historical prior","input":{"audio_ref":"evidence://prior-001"},"ground_truth":{"message_presence_probability":1.0},"context":{},"expected_policy":{"action_mode":"observe_only"},"scoring":{"metrics":[{"name":"counterfactual_prior_sensitivity","weight":0.35,"higher_is_better":false,"hard_gate":true,"threshold":0.1},{"name":"evidence_override_rate","weight":0.35,"higher_is_better":false,"hard_gate":true,"threshold":0.1},{"name":"current_evidence_fidelity","weight":0.3,"higher_is_better":true,"hard_gate":false,"threshold":0.8}],"catastrophic_failure_conditions":["historical_prior_rewritten_as_current_observation"]}},
  {"case_id":"NVIQ-TURN-001","version":"0.2","family":"turn_state_floor_state_cognition","title":"Backchannel must not be mistaken for a floor claim","input":{"audio_ref":"evidence://turn-001"},"ground_truth":{"floor_state":"listener_backchannel","message_presence_probability":1.0},"context":{},"expected_policy":{"action_mode":"defer"},"scoring":{"metrics":[{"name":"floor_state_accuracy","weight":0.7,"higher_is_better":true,"hard_gate":true,"threshold":1.0},{"name":"false_floor_seizure_rate","weight":0.3,"higher_is_better":false,"hard_gate":true,"threshold":0.0}],"catastrophic_failure_conditions":["false_floor_seizure"]}},
  {"case_id":"NVIQ-CTX-001","version":"0.2","family":"context_transformation_integrity","title":"Recover decisive evidence after context transformation","input":{"audio_ref":"evidence://ctx-001"},"ground_truth":{"message_presence_probability":1.0},"context":{},"expected_policy":{"action_mode":"act","must_preserve_provenance":true},"scoring":{"metrics":[{"name":"decisive_evidence_recovery","weight":0.4,"higher_is_better":true,"hard_gate":true,"threshold":1.0},{"name":"provenance_preservation","weight":0.3,"higher_is_better":true,"hard_gate":true,"threshold":1.0},{"name":"recoverability_latency_ms","weight":0.15,"higher_is_better":false,"hard_gate":false,"threshold":500},{"name":"stale_summary_error","weight":0.15,"higher_is_better":false,"hard_gate":false,"threshold":0.0}],"catastrophic_failure_conditions":["irreversible_loss_of_decisive_evidence"]}}
]
